{
  "schemaVersion": 1,
  "kind": "steamzero-theme-v1",
  "id": "org.steamzero.default",
  "name": "SteamZero",
  "version": "1.1.0",
  "author": "SteamZero contributors",
  "license": "GPL-3.0-or-later",
  "description": "Tema editorial SteamZero: superfícies mineral mist e mídia contextual resolvida em runtime.",
  "compatibility": { "themeApi": 1 },
  "tokens": {
    "color": {
      "background": "#e7eceb",
      "sidebar": "#d8dfdf",
      "surface": "#f4f7f5",
      "surfaceRaised": "#ffffff",
      "surfaceSelected": "#dce8e8",
      "border": "#aebdbe",
      "text": "#16212a",
      "textMuted": "#53616b",
      "textDisabled": "#7a878b",
      "accent": "#006f99",
      "accentStrong": "#005471",
      "success": "#167a45",
      "successSurface": "#dff3e7",
      "warning": "#9a5a00",
      "warningSurface": "#fff0d5",
      "danger": "#ae2634",
      "dangerSurface": "#fbe2e5",
      "focus": "#006f99"
    },
    "geometry": {
      "radiusSmall": 6,
      "radiusMedium": 10,
      "radiusLarge": 16,
      "borderWidth": 1,
      "focusWidth": 2,
      "minimumTarget": 48,
      "spacingSmall": 8,
      "spacingMedium": 16,
      "spacingLarge": 24
    },
    "typography": {
      "scale": 1.0,
      "weightBody": 400,
      "weightStrong": 600,
      "weightHeading": 700
    },
    "motion": {
      "durationFast": 120,
      "durationNormal": 180,
      "durationLong": 300,
      "hoverIntensity": 0.05,
      "focusIntensity": 0.1
    },
    "stateVariants": {
      "focusedScale": 1.05,
      "peripheralOpacity": 0.58,
      "selectedOpacity": 1.0
    },
    "interaction": {
      "focusVisible": true,
      "minimumTarget": 48
    },
    "accessibility": {
      "systemOverrides": true
    },
    "performance": {
      "defaultTier": "cinematic"
    }
  },
  "effects": {
    "schemaVersion": 1,
    "stacks": {
      "contextualBackdrop": [
        { "type": "blur", "radius": 28, "fallback": "omit" },
        { "type": "saturation", "amount": -0.38, "fallback": "minimal" },
        { "type": "colorize", "color": "#10212c", "strength": 0.28, "fallback": "omit" },
        { "type": "vignette", "color": "#071019", "strength": 0.22, "fallback": "omit" }
      ],
      "focusedCover": [
        { "type": "shadow", "color": "#071019", "opacity": 0.42, "blur": 18, "offsetY": 6, "fallback": "minimal" },
        { "type": "glow", "color": "#13bdf2", "strength": 0.12, "blur": 12, "fallback": "omit" }
      ],
      "peripheralCover": [
        { "type": "saturation", "amount": -0.58, "fallback": "minimal" },
        { "type": "opacity", "amount": 0.58, "fallback": "minimal" }
      ]
    }
  },
  "assets": {}
}
